"Measure ID","Measure Name","Score","Footnote","Measure Start Date","Measure End Date"
"OP_10","Abdomen CT Use of Contrast Material","9.4","","07/01/2013","06/30/2014"
"OP_11","Thorax CT Use of Contrast Material","2.4","","07/01/2013","06/30/2014"
"OP_13","Outpatients who got cardiac imaging stress tests before low-risk outpatient surgery","5.0","","07/01/2013","06/30/2014"
"OP_14","Outpatients with brain CT scans who got a sinus CT scan at the same time","2.8","","07/01/2013","06/30/2014"
"OP_8","MRI Lumbar Spine for Low Back Pain","Not Available","4 - Data suppressed by CMS for one or more quarters.","07/01/2013","06/30/2014"
"OP_9","Mammography Follow-up Rates","8.9","","07/01/2013","06/30/2014"
